{
  "version": 2,
  "id": "etcdraft-v3.6-public-candidates-v1-qualification",
  "candidate_catalog_digest": "bf1d2612137c9a9a60e83e76acf0f21e3752909f6d5bf8fcffc74d83e0866e3b",
  "capability_snapshot_digest": "39032033962a2f8b808cc0834038882550f561ca7ef44da7c4d75ee6212abf1f",
  "capability_snapshot": {
    "version": 2,
    "id": "etcdraft-v3.6-capability-snapshot-v2",
    "protocol": "etcd-raft-v3.6",
    "family": "raft",
    "profile_id": "raft-campaign/raft-three-node-cft-v1",
    "profile_digest": "09e9e507c84234c15cebf942d5d43aa08511cc0d6a48d7c3dc36aa3399dc14b6",
    "driver_manifest_digest": "eb063dd3066ed7249b4eb4640d4bd0a253ae16a74353be86556138d6ea83fad2",
    "controllable_inputs": [
      "campaign",
      "crash",
      "duplicate",
      "heal",
      "message",
      "partition",
      "propose",
      "restart",
      "start"
    ],
    "observable_events": [
      "event:acknowledge",
      "event:apply",
      "event:campaign",
      "event:crash",
      "event:duplicate",
      "event:emit",
      "event:heal",
      "event:message",
      "event:partition",
      "event:persist",
      "event:propose",
      "event:restart",
      "event:sync",
      "observation-kind:commit",
      "observation-kind:fault",
      "observation-kind:transition",
      "observation-kind:transport",
      "observation-label:commit",
      "observation-label:fault:crash",
      "observation-label:fault:restart",
      "observation-label:host:apply",
      "observation-label:message:delivered",
      "observation-label:message:dropped",
      "observation-label:message:duplicated",
      "observation-label:message:released",
      "observation-label:network:heal",
      "observation-label:network:partition",
      "observation-label:transition:candidate-\u003efollower",
      "observation-label:transition:candidate-\u003eleader",
      "observation-label:transition:follower-\u003ecandidate",
      "observation-label:transition:leader-\u003efollower",
      "semantic:raft-family-pss-v1/durable-normal-log-relation-after",
      "semantic:raft-family-pss-v1/event-target-role-after",
      "semantic:raft-family-pss-v1/event-target-role-before",
      "semantic:raft-family-pss-v1/leader-count-after",
      "semantic:raft-family-pss-v1/partition-shape"
    ],
    "driver_capabilities": [
      "application-apply",
      "explicit-campaign",
      "message-drop-duplicate-partition",
      "message-release-control",
      "power-loss-restart",
      "ready-crash-cutpoints",
      "visible-write-durable-sync"
    ],
    "trusted_monitors": [
      "agreement"
    ],
    "execution_outcomes": [
      "campaign-report-v2",
      "deterministic-trace-replay",
      "in-process-error-classified",
      "oracle-from-saved-trace"
    ],
    "profile_bounds": [
      "crashes\u003e=1",
      "election-rounds\u003e=1",
      "election-rounds\u003e=2",
      "fault-model=cft",
      "nodes=3",
      "partitions\u003e=1",
      "proposals\u003e=1",
      "proposals\u003e=2",
      "restarts\u003e=1"
    ]
  },
  "results": [
    {
      "candidate_id": "etcdraft-0675f3d-ready-must-sync",
      "status": "deferred",
      "missing_requirements": [
        {
          "type": "controllable-input",
          "id": "ready-with-unchanged-hard-state",
          "reason_code": "missing.controllable-input.ready-with-unchanged-hard-state"
        },
        {
          "type": "observable-event",
          "id": "ready-must-sync",
          "reason_code": "missing.observable-event.ready-must-sync"
        },
        {
          "type": "driver-capability",
          "id": "conditional-ready-sync",
          "reason_code": "missing.driver-capability.conditional-ready-sync"
        },
        {
          "type": "driver-capability",
          "id": "ready-must-sync-observation",
          "reason_code": "missing.driver-capability.ready-must-sync-observation"
        },
        {
          "type": "trusted-monitor",
          "id": "ready-must-sync",
          "reason_code": "missing.trusted-monitor.ready-must-sync"
        }
      ],
      "reason_codes": [
        "missing.controllable-input.ready-with-unchanged-hard-state",
        "missing.observable-event.ready-must-sync",
        "missing.driver-capability.conditional-ready-sync",
        "missing.driver-capability.ready-must-sync-observation",
        "missing.trusted-monitor.ready-must-sync"
      ]
    },
    {
      "candidate_id": "etcdraft-63903dd-duplicate-read-index",
      "status": "deferred",
      "missing_requirements": [
        {
          "type": "controllable-input",
          "id": "read-index",
          "reason_code": "missing.controllable-input.read-index"
        },
        {
          "type": "observable-event",
          "id": "read-state",
          "reason_code": "missing.observable-event.read-state"
        },
        {
          "type": "driver-capability",
          "id": "read-index-input",
          "reason_code": "missing.driver-capability.read-index-input"
        },
        {
          "type": "driver-capability",
          "id": "read-state-observation",
          "reason_code": "missing.driver-capability.read-state-observation"
        },
        {
          "type": "trusted-monitor",
          "id": "linearizable-read",
          "reason_code": "missing.trusted-monitor.linearizable-read"
        }
      ],
      "reason_codes": [
        "missing.controllable-input.read-index",
        "missing.observable-event.read-state",
        "missing.driver-capability.read-index-input",
        "missing.driver-capability.read-state-observation",
        "missing.trusted-monitor.linearizable-read"
      ]
    },
    {
      "candidate_id": "etcdraft-76f1249-log-truncation-panic",
      "status": "deferred",
      "missing_requirements": [
        {
          "type": "controllable-input",
          "id": "log-compaction",
          "reason_code": "missing.controllable-input.log-compaction"
        },
        {
          "type": "driver-capability",
          "id": "log-compaction-control",
          "reason_code": "missing.driver-capability.log-compaction-control"
        },
        {
          "type": "execution-outcome",
          "id": "process-exit-classified",
          "reason_code": "missing.execution-outcome.process-exit-classified"
        },
        {
          "type": "profile-bound",
          "id": "slow-follower-inflight-saturation",
          "reason_code": "missing.profile-bound.slow-follower-inflight-saturation"
        }
      ],
      "reason_codes": [
        "missing.controllable-input.log-compaction",
        "missing.driver-capability.log-compaction-control",
        "missing.execution-outcome.process-exit-classified",
        "missing.profile-bound.slow-follower-inflight-saturation"
      ]
    },
    {
      "candidate_id": "etcdraft-8ecce32-committed-pagination",
      "status": "deferred",
      "missing_requirements": [
        {
          "type": "controllable-input",
          "id": "committed-entry-pagination",
          "reason_code": "missing.controllable-input.committed-entry-pagination"
        },
        {
          "type": "observable-event",
          "id": "committed-entry-page",
          "reason_code": "missing.observable-event.committed-entry-page"
        },
        {
          "type": "driver-capability",
          "id": "committed-entries-pagination",
          "reason_code": "missing.driver-capability.committed-entries-pagination"
        },
        {
          "type": "trusted-monitor",
          "id": "committed-entry-continuity",
          "reason_code": "missing.trusted-monitor.committed-entry-continuity"
        },
        {
          "type": "profile-bound",
          "id": "committed-entry-page-boundary",
          "reason_code": "missing.profile-bound.committed-entry-page-boundary"
        }
      ],
      "reason_codes": [
        "missing.controllable-input.committed-entry-pagination",
        "missing.observable-event.committed-entry-page",
        "missing.driver-capability.committed-entries-pagination",
        "missing.trusted-monitor.committed-entry-continuity",
        "missing.profile-bound.committed-entry-page-boundary"
      ]
    }
  ]
}
